Ward O.G.; Huang Z.; Davison A.; Zheng T.,"Ward, Owen G. (57219506014); Huang, Zhen (57226054165); Davison, Andrew (57219761158); Zheng, Tian (7201358841)",57219506014; 57226054165; 57219761158; 7201358841,Next waves in veridical network embedding*,2021,Statistical Analysis and Data Mining,14,1,,5,17,12,3,10.1002/sam.11486,https://www.scopus.com/inward/record.uri?eid=2-s2.0-85096673069&doi=10.1002%2fsam.11486&partnerID=40&md5=bab9ea05be255a40566fdee4f24af33e,"Department of Statistics, Columbia University, New York, NY, United States; Data Science Institute, Columbia University, New York, NY, United States","Ward O.G., Department of Statistics, Columbia University, New York, NY, United States; Huang Z., Department of Statistics, Columbia University, New York, NY, United States; Davison A., Department of Statistics, Columbia University, New York, NY, United States; Zheng T., Department of Statistics, Columbia University, New York, NY, United States, Data Science Institute, Columbia University, New York, NY, United States","Embedding nodes of a large network into a metric (e.g., Euclidean) space has become an area of active research in statistical machine learning, which has found applications in natural and social sciences. Generally, a representation of a network object is learned in a Euclidean geometry and is then used for subsequent tasks regarding the nodes and/or edges of the network, such as community detection, node classification and link prediction. Network embedding algorithms have been proposed in multiple disciplines, often with domain-specific notations and details. In addition, different measures and tools have been adopted to evaluate and compare the methods proposed under different settings, often dependent of the downstream tasks. As a result, it is challenging to study these algorithms in the literature systematically. Motivated by the recently proposed PCS framework for Veridical Data Science, we propose a framework for network embedding algorithms and discuss how the principles of predictability, computability, and stability (PCS) apply in this context. The utilization of this framework in network embedding holds the potential to motivate and point to new directions for future research. © 2020 Wiley Periodicals LLC",feature engineering; latent variable models; network embedding; representational learning; veridical data science,Data Science; Community detection; Domain specific; Euclidean Geometry; Link prediction; Multiple disciplines; Network embedding; Network objects; Statistical machine learning; Embeddings,English,Review,Final,All Open Access; Bronze Open Access; Green Open Access,Scopus
Alqudah N.; Shatnawi M.Q.,"Alqudah, Nour (57216971606); Shatnawi, Mohammed Q. (24723220900)",57216971606; 24723220900,The Role of Big Data in Social Science: A Case Study Using Hadoop,2022,Lecture Notes in Networks and Systems,216,,,243,251,8,0,10.1007/978-981-16-1781-2_23,https://www.scopus.com/inward/record.uri?eid=2-s2.0-85115621662&doi=10.1007%2f978-981-16-1781-2_23&partnerID=40&md5=8747eb22260162e07263a51f9964e90c,"Department of Computer Information System, Jordan University of Science and Technology, Irbid, Jordan","Alqudah N., Department of Computer Information System, Jordan University of Science and Technology, Irbid, Jordan; Shatnawi M.Q., Department of Computer Information System, Jordan University of Science and Technology, Irbid, Jordan","The research on big data in the social sciences and its impact has received much interest from practitioners and policy-makers. Data science can help find the answer to research questions in the social sciences because data is the lifeblood of the decision-making process; it is also the raw material for the accountability process. New data sources, new technologies, and new analytical approaches can make evidence-based decision-making more efficient and flexible. The analysis of this data plays a large role in discussing the challenges facing our societies today. This research provides an analysis of the six factors that influence happiness—GDP per capita, social support, life expectancy, freedom, corruption, and generosity. In this research, the World Happiness Report was studied in 2019, where its survey of the state of global happiness ranks 156 countries through their citizens’ happiness. Depending on six factors. This study focuses on analyzing factors that affect happiness and satisfaction with life. © 2022, The Author(s), under exclusive license to Springer Nature Singapore Pte Ltd.",Big data; Big data analytics; CDH; Hadoop; Hue; Life expectancy; Social science; Social support; World Happiness Report,,English,Conference paper,Final,,Scopus
Sadowski J.; Viljoen S.; Whittaker M.,"Sadowski, Jathan (44261711900); Viljoen, Salomé (57211476548); Whittaker, Meredith (57196481696)",44261711900; 57211476548; 57196481696,Everyone should decide how their digital data are used - not just tech companies,2021,Nature,595,7866,,169,171,2,18,10.1038/d41586-021-01812-3,https://www.scopus.com/inward/record.uri?eid=2-s2.0-85110356463&doi=10.1038%2fd41586-021-01812-3&partnerID=40&md5=c7057a4addb03b09cf7cf486e7b7cfb8,,,[No abstract available],Databases; Human behaviour; Information technology; Intellectual-property rights; Society,Artificial Intelligence; Behavioral Research; Data Science; Datasets as Topic; Democracy; Humans; Industry; Information Dissemination; Open Access Publishing; Smartphone; Social Conditions; Social Sciences; artificial intelligence; behavioral research; democracy; economics; ethics; human; industry; information dissemination; information processing; open access publishing; procedures; smartphone; social status; sociology,English,Article,Final,All Open Access; Bronze Open Access,Scopus
Forgó N.; Hänold S.; van den Hoven J.; Krügel T.; Lishchuk I.; Mahieu R.; Monreale A.; Pedreschi D.; Pratesi F.; van Putten D.,"Forgó, Nikolaus (35233039300); Hänold, Stefanie (55569254600); van den Hoven, Jeroen (11840074900); Krügel, Tina (27267673400); Lishchuk, Iryna (56572780600); Mahieu, René (57202718937); Monreale, Anna (35113703300); Pedreschi, Dino (6603935985); Pratesi, Francesca (56239725400); van Putten, David (57202711740)",35233039300; 55569254600; 11840074900; 27267673400; 56572780600; 57202718937; 35113703300; 6603935985; 56239725400; 57202711740,An ethico-legal framework for social data science,2021,International Journal of Data Science and Analytics,11,4,,377,390,13,5,10.1007/s41060-020-00211-7,https://www.scopus.com/inward/record.uri?eid=2-s2.0-85087962799&doi=10.1007%2fs41060-020-00211-7&partnerID=40&md5=20d6e3c333c37c9eaea43ca1d07f6d51,"Universität Wien, Vienna, Austria; Leibniz Universität Hannover, Hannover, Germany; Delft University of Technology, Delft, Netherlands; Vrije Universiteit Brussel, Brussels, Belgium; University of Pisa, Pisa, Italy; ISTI-CNR, Pisa, Italy","Forgó N., Universität Wien, Vienna, Austria; Hänold S., Leibniz Universität Hannover, Hannover, Germany; van den Hoven J., Delft University of Technology, Delft, Netherlands; Krügel T., Leibniz Universität Hannover, Hannover, Germany; Lishchuk I., Leibniz Universität Hannover, Hannover, Germany; Mahieu R., Delft University of Technology, Delft, Netherlands, Vrije Universiteit Brussel, Brussels, Belgium; Monreale A., University of Pisa, Pisa, Italy; Pedreschi D., University of Pisa, Pisa, Italy; Pratesi F., University of Pisa, Pisa, Italy, ISTI-CNR, Pisa, Italy; van Putten D., Delft University of Technology, Delft, Netherlands","This paper presents a framework for research infrastructures enabling ethically sensitive and legally compliant data science in Europe. Our goal is to describe how to design and implement an open platform for big data social science, including, in particular, personal data. To this end, we discuss a number of infrastructural, organizational and methodological principles to be developed for a concrete implementation. These include not only systematically tools and methodologies that effectively enable both the empirical evaluation of the privacy risk and data transformations by using privacy-preserving approaches, but also the development of training materials (a massive open online course) and organizational instruments based on legal and ethical principles. This paper provides, by way of example, the implementation that was adopted within the context of the SoBigData Research Infrastructure. © 2020, The Author(s).",Ethical data science; Legal data science; Research infrastructure,Data Science; Distance education; Data transformation; Design and implements; Empirical evaluations; Ethical principles; Massive open online course; Privacy preserving; Research infrastructure; Training material; Privacy by design,English,Article,Final,All Open Access; Green Open Access; Hybrid Gold Open Access,Scopus
Castano S.; Ferrara A.; Giannini G.; Montanelli S.; Periti F.,"Castano, Silvana (56267928600); Ferrara, Alfio (7201825221); Giannini, Giulia (57311693600); Montanelli, Stefano (6506356009); Periti, Francesco (57312581800)",56267928600; 7201825221; 57311693600; 6506356009; 57312581800,A Computational History Approach to Interpretation and Analysis of Moral European Values: The VAST Research Project,2021,CEUR Workshop Proceedings,2981,,,,,,0,,https://www.scopus.com/inward/record.uri?eid=2-s2.0-85117908381&partnerID=40&md5=7d7864fb843460d0bfeb8491cff0a609,"Università Degli Studi di Milano, Department of Computer Science, Via Celoria, 18, Milano, 20133, Italy; Università Degli Studi di Milano, Department of Historical Studies, Via Festa del Perdono, 7, Milano, 20122, Italy","Castano S., Università Degli Studi di Milano, Department of Computer Science, Via Celoria, 18, Milano, 20133, Italy; Ferrara A., Università Degli Studi di Milano, Department of Computer Science, Via Celoria, 18, Milano, 20133, Italy; Giannini G., Università Degli Studi di Milano, Department of Historical Studies, Via Festa del Perdono, 7, Milano, 20122, Italy; Montanelli S., Università Degli Studi di Milano, Department of Computer Science, Via Celoria, 18, Milano, 20133, Italy; Periti F., Università Degli Studi di Milano, Department of Computer Science, Via Celoria, 18, Milano, 20133, Italy","The rapid development and diffusion of artificial intelligence and data science techniques enable research in the field of humanities and social sciences to become more and more computational. In this paper, we present the computational history approach featuring the VAST project aiming to study the transformation of moral values across space and time, by collecting, digitising, and analysing narratives and experiences, with particular emphasis on the core European Values, such as freedom, democracy, equality. © 2021 CEUR-WS. All rights reserved.",Computational History; Knowledge Modeling; Ontology-based data management,Ontology; Computational history; Humanities and social science; Knowledge model; Ontology-based; Ontology-based data management; Space and time; Information management,English,Conference paper,Final,,Scopus
Amin F.; Choi G.S.,"Amin, Farhan (57194650651); Choi, Gyu Sang (9734383700)",57194650651; 9734383700,Social pal: A combined platform for internet of things and social networks,2020,"2020 5th International Conference on Computer and Communication Systems, ICCCS 2020",,,9118579,786,790,4,8,10.1109/ICCCS49078.2020.9118579,https://www.scopus.com/inward/record.uri?eid=2-s2.0-85087499144&doi=10.1109%2fICCCS49078.2020.9118579&partnerID=40&md5=0f5ad5f64c133fc34b7d43c65c766703,"Yeungnam University, Department of Information and Communication Engineering, Gyeongsan, South Korea","Amin F., Yeungnam University, Department of Information and Communication Engineering, Gyeongsan, South Korea; Choi G.S., Yeungnam University, Department of Information and Communication Engineering, Gyeongsan, South Korea","Social Internet of Things (SIoT) is a new model that has integrated into two technologies, Internet of Things (IoT) and Social Networks. The SIoT defines as a social network of objects that are not only smarter but also socially conscious. The major issues related to IoT are; communication between the objects, service composition and service discovery. To address the after-mentioned needs, this paper proposes a possible approach named social pal. The social pal collects and provides the information to the IoT, and hence our proposed social network provides glue to allow the human to device interaction. This study leverages the social relationships among the participants (devices and users) in the system for delivering the required services to the users. By using this platform the capability to select and find the devices, discover the services in the IoT paradigm is augmented. Briefly, the main features of social pal are; create an object, define the relationship, find and discover the pairs of objects that can offer services, etc. © 2020 IEEE.",Big data; Data Science; Internet of things; Social internet of things,Social networking (online); Social sciences computing; Internet of Things (IOT); Service compositions; Service discovery; Social relationships; Internet of things,English,Conference paper,Final,,Scopus
Stitzlein C.; Fielke S.; Waldner F.; Sanderson T.,"Stitzlein, Cara (25825567400); Fielke, Simon (55889748900); Waldner, François (56702293300); Sanderson, Todd (35094649500)",25825567400; 55889748900; 56702293300; 35094649500,Reputational risk associated with big data research and development: An interdisciplinary perspective,2021,Sustainability (Switzerland),13,16,9280,,,,10,10.3390/su13169280,https://www.scopus.com/inward/record.uri?eid=2-s2.0-85113326809&doi=10.3390%2fsu13169280&partnerID=40&md5=2535db83bba15e871de1558cff0afbf7,"CSIRO Data61, Hobart, 7005, Australia; CSIRO Land and Water, Dutton Park, 4102, Australia; European Commission Joint Research Centre, Ispra, 21027, Italy; Australian Centre for International Agricultural Research, Canberra, 2601, Australia","Stitzlein C., CSIRO Data61, Hobart, 7005, Australia; Fielke S., CSIRO Land and Water, Dutton Park, 4102, Australia; Waldner F., European Commission Joint Research Centre, Ispra, 21027, Italy; Sanderson T., Australian Centre for International Agricultural Research, Canberra, 2601, Australia","Many private and public actors are incentivized by the promises of big data technologies: digital tools underpinned by capabilities like artificial intelligence and machine learning. While many shared value propositions exist regarding what these technologies afford, public-facing concerns related to individual privacy, algorithm fairness, and the access to insights requires attention if the widespread use and subsequent value of these technologies are to be fully realized. Drawing from perspectives of data science, social science and technology acceptance, we present an interdisciplinary analysis that links these concerns with traditional research and development (R&D) activities. We suggest a reframing of the public R&D ‘brand’ that responds to legitimate concerns related to data collection, development, and the implementation of big data technologies. We offer as a case study Australian agriculture, which is currently undergoing such digitalization, and where concerns have been raised by landholders and the research community. With seemingly limitless possibilities, an updated account of responsible R&D in an increasingly digitalized world may accelerate the ways in which we might realize the benefits of big data and mitigate harmful social and environmental costs. © 2021 by the authors. Licensee MDPI, Basel, Switzerland.",Big data; Digital agriculture; Digital transformation; Innovation systems; Interdisciplinary science; Reputational risk; Research and development; Responsible innovation; Responsible prediction,algorithm; artificial intelligence; interdisciplinary approach; machine learning; risk assessment; science and technology,English,Article,Final,All Open Access; Gold Open Access,Scopus
Nath Singh P.,"Nath Singh, Paras (57226821281)",57226821281,"""I-Care""-Big-data Analytics for Intelligent Systems",2021,"2021 8th International Conference on Smart Computing and Communications: Artificial Intelligence, AI Driven Applications for a Smart World, ICSCC 2021",,,,225,229,4,0,10.1109/ICSCC51209.2021.9528292,https://www.scopus.com/inward/record.uri?eid=2-s2.0-85115677640&doi=10.1109%2fICSCC51209.2021.9528292&partnerID=40&md5=14f8c50bd737c09285922ad283998cc5,"CMR Institute of Technology, Department of CSE, Bengaluru, 560037, India","Nath Singh P., CMR Institute of Technology, Department of CSE, Bengaluru, 560037, India","A very novel predicament for quantitative data science has been generated by the abundance of large, well-cured data sets in biological and social science, coupled with an extraordinary increase in computational ability. This is the possibility of sophisticated studies combined with remedial understanding. Analytics for intelligent systems should cover architecture of hardware platforms and application of software methods, technique and tools. It is anticipated that adapting dynamic memory information, processing parametric values of large data sheets with optimization, would be faster. The field of Big-Data Analytics under recent trends of Data Science studies various means of pre-processing, analyzing and filtering from huge and semi-structured data sets from different sources which are complex to be handled by traditional data processing systems. In addition to extracting and aggregating data from various main performance measures, this proposal also forecasts potential values for these KPIs (Key Performance Indicators) and alerts them when unfavorable values are about to occur. As AI and ML are implemented through different platforms and sectors including chat-bots, robotics, social media, healthcare, self-driven automobile and space exploration, large companies are investing in these fields, and the demand for ML and AI experts is growing accordingly. Python is becoming the most popular language for AI (Artificial Intelligence and Machine Learning) due to its rich supported tools. This proposed applications ""I-Care""(Intelligent Care) provide recommendations to improve Quality of Service of Big-data analytics. So, the proposed paper examines the methodology and requirements, architecture, modeling and analytics with implementation and describes the architectural design and the results obtained by the pilot application using Python and its powerful tools like Pandas and Scikit-Learn.  © 2021 IEEE.",Artificial Intelligence; Big Data Analytics; Healthcare; Intelligent Systems; Machine Learning; Python,Application programs; Benchmarking; Big data; Data Analytics; Data handling; High level languages; Intelligent systems; Memory architecture; Quality of service; Space platforms; Space research; Computational ability; Data processing systems; Hardware platform; Key performance indicators; Performance measure; Pilot applications; Semi structured data; Space explorations; Advanced Analytics,English,Conference paper,Final,,Scopus
Kahere M.; Ginindza T.,"Kahere, Morris (57215828311); Ginindza, Themba (24468039800)",57215828311; 24468039800,The prevalence and psychosocial risk factors of chronic low back pain in KwaZulu-Natal,2022,African Journal of Primary Health Care and Family Medicine,14,1,a3134,,,,4,10.4102/phcfm.v14i1.3134,https://www.scopus.com/inward/record.uri?eid=2-s2.0-85124358698&doi=10.4102%2fphcfm.v14i1.3134&partnerID=40&md5=49e9ece72ea1a787ede710d75c76b552,"Discipline of Public Health Medicine, School of Nursing and Public Health, Faculty of Health Sciences, University of KwaZulu-Natal, Durban, South Africa","Kahere M., Discipline of Public Health Medicine, School of Nursing and Public Health, Faculty of Health Sciences, University of KwaZulu-Natal, Durban, South Africa; Ginindza T., Discipline of Public Health Medicine, School of Nursing and Public Health, Faculty of Health Sciences, University of KwaZulu-Natal, Durban, South Africa","Background: Chronic low back pain (CLBP) is the leading cause of disability and has been extensively investigated in high-income countries (HICs), with little done in low-and middleincome countries. Biomechanical stressors do not have a major pathogenic role, but psychosocial predisposition is important. The occurrence and progression of CLBP are significantly affected by psychosocial risk factors. Guidelines recommend the early identification of psychosocial factors that could predict CLBP. Aim: To determine the prevalence and psychosocial risk factors for CLBP amongst adults in KwaZulu-Natal, South Africa. Setting: The study was conducted at five randomly selected public hospitals in KwaZulu-Natal. Methods: Analytical cross-sectional hospital-based study utilising a self-administered questionnaire to collect data on (1) sociodemographic, (2) disability, (3) fear-avoidance beliefs and (4) illness behaviour. The Statistical Package for the Social Sciences (SPSS) 24.0 was used for data cleaning and descriptive statistics. Chi-square test was used for categorical variables. Standard Edition of the Statistical Software for Data Science version 17.0 (STATA 17.0 SE) was used to identify risk factors using the logistic regression analysis. A />-value of < 0.05 was deemed statistically significant. Results: Overall prevalence of CLBP was 22.2% (95% confidence interval [CI]: 18.8-25.9). Females had a higher prevalence of CLBP than males, 23.9% (95% CI: 19.4-28.9) and 19.7% (95% CI: 14.8-25.5), respectively; however, the difference was not significant p = 0.243. The multivariate regression analysis identified the following risk factors: female gender, middleaged adults 38-47 years, obesity, disease conviction, affective disturbance, denial and fearavoidance behaviour-work subscale. Conclusion: There is a high prevalence of CLBP amongst the study participants. Psychosocial factors (disease conviction, affective disturbance and fear-avoidance behaviour about work) are significant predictors of CLBP. © 2022. The Authors. Licensee: AOSIS. This work is licensed under the Creative Commons Attribution License. All Rights Reserved.",chronic low back pain; KwaZulu-Natal; prevalence; psychological predictors; risk factors,Adult; Cross-Sectional Studies; Disability Evaluation; Female; Humans; Low Back Pain; Male; Middle Aged; Prevalence; Risk Factors; South Africa; adult; cross-sectional study; disability; female; human; low back pain; male; middle aged; prevalence; risk factor; South Africa,English,Article,Final,All Open Access; Gold Open Access; Green Open Access,Scopus
