Y Piontti A.P.; Perra N.; Rossi L.; Samay N.; Vespignani A.,"Y Piontti, Ana Pastore (57272315500); Perra, Nicola (24824755600); Rossi, Luca (7401505532); Samay, Nicole (57194280541); Vespignani, Alessandro (7004546582)",57272315500; 24824755600; 7401505532; 57194280541; 7004546582,Charting the Next Pandemic: Modeling Infectious Disease Spreading in the Data Science Age,2018,Charting the Next Pandemic: Modeling Infectious Disease Spreading in the Data Science Age,,,,1,209,208,22,10.1007/978-3-319-93290-3,https://www.scopus.com/inward/record.uri?eid=2-s2.0-85151670513&doi=10.1007%2f978-3-319-93290-3&partnerID=40&md5=16bf61bc48d1b5a766aeb362831203d0,"Laboratory for the Modeling of Biological and Socio-technical Systems (MOBS Lab), Northeastern University, Boston, United States; University of Greenwich, United Kingdom; Institute for Scientific Interchange, Torino, Italy; Network Science Institute at Northeastern University, Boston, United States; Northeastern University, Boston, United States; American Physical Society, United States; Academy of Europe, United Kingdom; Institute for Quantitative Social Sciences, Harvard University, United States","Y Piontti A.P., Laboratory for the Modeling of Biological and Socio-technical Systems (MOBS Lab), Northeastern University, Boston, United States; Perra N., University of Greenwich, United Kingdom; Rossi L., Institute for Scientific Interchange, Torino, Italy; Samay N., Network Science Institute at Northeastern University, Boston, United States; Vespignani A., Northeastern University, Boston, United States, American Physical Society, United States, Academy of Europe, United Kingdom, Institute for Quantitative Social Sciences, Harvard University, United States","This book provides an introduction to the computational and complex systems modeling of the global spreading of infectious diseases. The latest developments in the area of contagion processes modeling are discussed, and readers are exposed to real world examples of data-model integration impacting the decision-making process. Recent advances in computational science and the increasing availability of real-world data are making it possible to develop realistic scenarios and real-time forecasts of the global spreading of emerging health threats. The first part of the book guides the reader through sophisticated complex systems modeling techniques with a non-technical and visual approach, explaining and illustrating the construction of the modern framework used to project the spread of pandemics and epidemics. Models can be used to transform data to knowledge that is intuitively communicated by powerful infographics and for this reason, the second part of the book focuses on a set of charts that illustrate possible scenarios of future pandemics. The visual atlas contained allows the reader to identify commonalities and patterns in emerging health threats, as well as explore the wide range of models and data that can be used by policy makers to anticipate trends, evaluate risks and eventually manage future events. Charting the Next Pandemic puts the reader in the position to explore different pandemic scenarios and to understand the potential impact of available containment and prevention strategies. This book emphasizes the importance of a global perspective in the assessment of emerging health threats and captures the possible evolution of the next pandemic, while at the same time providing the intelligence needed to fight it. The text will appeal to a wide range of audiences with diverse technical backgrounds. © Springer International Publishing AG, part of Springer Nature 2019.","complex systems; computational epidemiology; computational social sciences; containment and mitigation scenarios; data driven modeling; data science; data-driven science, Modeling and theory building; epidemic data modeling; epidemic spreading; infectious diseases; modeling disease transmission",,English,Book,Final,All Open Access; Green Open Access,Scopus
Burger A.; Oz T.; Kennedy W.G.; Crooks A.T.,"Burger, Annetta (57196819609); Oz, Talha (55076701900); Kennedy, William G. (21739727700); Crooks, Andrew T. (25521036800)",57196819609; 55076701900; 21739727700; 25521036800,Computational social science of disasters: Opportunities and challenges,2019,Future Internet,11,5,103,,,,12,10.3390/fi11050103,https://www.scopus.com/inward/record.uri?eid=2-s2.0-85065923846&doi=10.3390%2ffi11050103&partnerID=40&md5=7d62db2f31c6455cfeb792dd56ed19a5,"Department of Computational and Data Sciences, George Mason University, Fairfax, 4400, VA, United States; Center for Social Complexity, George Mason University, Fairfax, 4400, VA, United States; Department of Geography and GeoInformation Science, George Mason University, Fairfax, 4400, VA, United States","Burger A., Department of Computational and Data Sciences, George Mason University, Fairfax, 4400, VA, United States, Center for Social Complexity, George Mason University, Fairfax, 4400, VA, United States; Oz T., Department of Computational and Data Sciences, George Mason University, Fairfax, 4400, VA, United States, Center for Social Complexity, George Mason University, Fairfax, 4400, VA, United States; Kennedy W.G., Department of Computational and Data Sciences, George Mason University, Fairfax, 4400, VA, United States, Center for Social Complexity, George Mason University, Fairfax, 4400, VA, United States; Crooks A.T., Department of Computational and Data Sciences, George Mason University, Fairfax, 4400, VA, United States, Center for Social Complexity, George Mason University, Fairfax, 4400, VA, United States, Department of Geography and GeoInformation Science, George Mason University, Fairfax, 4400, VA, United States","Disaster events and their economic impacts are trending, and climate projection studies suggest that the risks of disaster will continue to increase in the near future. Despite the broad and increasing social effects of these events, the empirical basis of disaster research is often weak, partially due to the natural paucity of observed data. At the same time, some of the early research regarding social responses to disasters have become outdated as social, cultural, and political norms have changed. The digital revolution, the open data trend, and the advancements in data science provide new opportunities for social science disaster research. We introduce the term computational social science of disasters (CSSD), which can be formally defined as the systematic study of the social behavioral dynamics of disasters utilizing computational methods. In this paper, we discuss and showcase the opportunities and the challenges in this new approach to disaster research. Following a brief review of the fields that relate to CSSD, namely traditional social sciences of disasters, computational social science, and crisis informatics, we examine how advances in Internet technologies offer a new lens through which to study disasters. By identifying gaps in the literature, we show how this new field could address ways to advance our understanding of the social and behavioral aspects of disasters in a digitally connected world. In doing so, our goal is to bridge the gap between data science and the social sciences of disasters in rapidly changing environments. © 2019 by the authors.",Big data; Computational social science; Crisis informatics; Crowdsourcing; Disaster modeling; Disasters; Social media; Volunteered geographical information; Web 2.0,Behavioral research; Big data; Crowdsourcing; Data Science; Disasters; Open Data; Social sciences computing; Computational social science; Crisis informatics; Geographical information; Social media; Web 2.0; Economic and social effects,English,Review,Final,All Open Access; Gold Open Access,Scopus
Taylor J.; Pagliari C.,"Taylor, Joanna (57206837301); Pagliari, Claudia (7003869461)",57206837301; 7003869461,Comprehensive scoping review of health research using social media data,2018,BMJ Open,8,12,e022931,,,,16,10.1136/bmjopen-2018-022931,https://www.scopus.com/inward/record.uri?eid=2-s2.0-85058781951&doi=10.1136%2fbmjopen-2018-022931&partnerID=40&md5=d15e28943c1fd5742044ae9de03908de,"Usher Institute for Population Health Sciences and Informatics, University of Edinburgh, Edinburgh, United Kingdom","Taylor J., Usher Institute for Population Health Sciences and Informatics, University of Edinburgh, Edinburgh, United Kingdom; Pagliari C., Usher Institute for Population Health Sciences and Informatics, University of Edinburgh, Edinburgh, United Kingdom","Introduction The rising popularity of social media, since their inception around 20 years ago, has been echoed in the growth of health-related research using data derived from them This has created a demand for literature reviews to synthesise this emerging evidence base and inform future activities Existing reviews tend to be narrow in scope, with limited consideration of the different types of data, analytical methods and ethical issues involved There has also been a tendency for research to be siloed within different academic communities (eg, computer science, public health), hindering knowledge translation To address these limitations, we will undertake a comprehensive scoping review, to systematically capture the broad corpus of published, health-related research based on social media data Here, we present the review protocol and the pilot analyses used to inform it Methods A version of Arksey and O'Malley's five-stage scoping review framework will be followed: (1) identifying the research question; (2) identifying the relevant literature; (3) selecting the studies; (4) charting the data and (5) collating, summarising and reporting the results To inform the search strategy, we developed an inclusive list of keyword combinations related to social media, health and relevant methodologies The frequency and variability of terms were charted over time and cross referenced with significant events, such as the advent of Twitter Five leading health, informatics, business and cross-disciplinary databases will be searched: PubMed, Scopus, Association of Computer Machinery, Institute of Electrical and Electronics Engineers and Applied Social Sciences Index and Abstracts, alongside the Google search engine There will be no restriction by date Ethics and dissemination The review focuses on published research in the public domain therefore no ethics approval is required The completed review will be submitted for publication to a peer-reviewed, interdisciplinary open access journal, and conferences on public health and digital research. © 2018 Author(s).",Data science; Digital health; Digital research; Ehealth; Public health informatics; Social media,Data Collection; Humans; Public Health; Research Design; Social Media; human; information processing; methodology; public health; social media,English,Article,Final,All Open Access; Gold Open Access; Green Open Access,Scopus
Sathiaraj D.; Cassidy W.M.; Rohli E.,"Sathiaraj, David (55355422900); Cassidy, William M. (57200856388); Rohli, Eric (57200860129)",55355422900; 57200856388; 57200860129,Improving Predictive Accuracy in Elections,2017,Big Data,5,4,,325,336,11,2,10.1089/big.2017.0047,https://www.scopus.com/inward/record.uri?eid=2-s2.0-85042550364&doi=10.1089%2fbig.2017.0047&partnerID=40&md5=ba25d3ef2d3a9af7e46ee4308d625570,"Department of Geography and Anthropology, Louisiana State University, E335 Howe Russell, Tower Drive, Baton Rouge, 70803-2804, LA, United States; NOAA Southern Regional Climate Center, Louisiana State University, Baton Rouge, LA, United States; Booth School of Business, University of Chicago, Chicago, IL, United States; College of Engineering, Louisiana State University, Baton Rouge, LA, United States","Sathiaraj D., Department of Geography and Anthropology, Louisiana State University, E335 Howe Russell, Tower Drive, Baton Rouge, 70803-2804, LA, United States, NOAA Southern Regional Climate Center, Louisiana State University, Baton Rouge, LA, United States; Cassidy W.M., Booth School of Business, University of Chicago, Chicago, IL, United States; Rohli E., NOAA Southern Regional Climate Center, Louisiana State University, Baton Rouge, LA, United States, College of Engineering, Louisiana State University, Baton Rouge, LA, United States","The problem of accurately predicting vote counts in elections is considered in this article. Typically, small-sample polls are used to estimate or predict election outcomes. In this study, a machine-learning hybrid approach is proposed. This approach utilizes multiple sets of static data sources, such as voter registration data, and dynamic data sources, such as polls and donor data, to develop individualized voter scores for each member of the population. These voter scores are used to estimate expected vote counts under different turnout scenarios. The proposed technique has been tested with data collected during U.S. Senate and Louisiana gubernatorial elections. The predicted results (expected vote counts, predicted several days before the actual election) were accurate within 1%. © 2017, Mary Ann Liebert, Inc.",behavioral analytics; computational social sciences; data science; machine learning; political big data; predict election outcomes; predictive analytics; voter scores,Algorithms; Computer Simulation; Humans; Machine Learning; Politics; United States; algorithm; computer simulation; human; machine learning; politics; United States,English,Article,Final,,Scopus
Çetinkaya-Rundel M.; Ellison V.,"Çetinkaya-Rundel, Mine (57193650765); Ellison, Victoria (56183272800)",57193650765; 56183272800,A Fresh Look at Introductory Data Science,2020,Journal of Statistics Education,,,,,,,18,10.1080/10691898.2020.1804497,https://www.scopus.com/inward/record.uri?eid=2-s2.0-85090969449&doi=10.1080%2f10691898.2020.1804497&partnerID=40&md5=3b51b58b25639c51948f896478e95474,"School of Mathematics, University of Edinburgh, Edinburgh, United Kingdom; Department of Statistical Science, Duke University, Durham, NC, United States; RStudio, Boston, MA, United States","Çetinkaya-Rundel M., School of Mathematics, University of Edinburgh, Edinburgh, United Kingdom, Department of Statistical Science, Duke University, Durham, NC, United States, RStudio, Boston, MA, United States; Ellison V., Department of Statistical Science, Duke University, Durham, NC, United States","The proliferation of vast quantities of available datasets that are large and complex in nature has challenged universities to keep up with the demand for graduates trained in both the statistical and the computational set of skills required to effectively plan, acquire, manage, analyze, and communicate the findings of such data. To keep up with this demand, attracting students early on to data science as well as providing them a solid foray into the field becomes increasingly important. We present a case study of an introductory undergraduate course in data science that is designed to address these needs. Offered at Duke University, this course has no prerequisites and serves a wide audience of aspiring statistics and data science majors as well as humanities, social sciences, and natural sciences students. We discuss the unique set of challenges posed by offering such a course, and in light of these challenges, we present a detailed discussion into the pedagogical design elements, content, structure, computational infrastructure, and the assessment methodology of the course. We also offer a repository containing all teaching materials that are open-source, along with supplementary materials and the R code for reproducing the figures found in the article. © 2020 The Author(s). Published with license by Taylor and Francis Group, LLC.",Data science curriculum; Data visualization; Exploratory data analysis; Modeling; R; Reproducibility,,English,Article,Article in press,All Open Access; Bronze Open Access; Green Open Access,Scopus
Scott P.J.; Dunscombe R.; Evans D.; Mukherjee M.; Wyatt J.C.,"Scott, Philip J. (56646701400); Dunscombe, Rachel (57191996300); Evans, David (57203374720); Mukherjee, Mome (55877538600); Wyatt, Jeremy C. (7202561946)",56646701400; 57191996300; 57203374720; 55877538600; 7202561946,Learning health systems need to bridge the 'two cultures' of clinical informatics and data science,2018,Journal of Innovation in Health Informatics,25,2,,126,131,5,20,10.14236/jhi.v25i2.1062,https://www.scopus.com/inward/record.uri?eid=2-s2.0-85048995502&doi=10.14236%2fjhi.v25i2.1062&partnerID=40&md5=056ae9163eb5d896bef4870f7231b6ba,"Centre for Healthcare Modelling and Informatics, School of Computing, University of Portsmouth, Portsmouth, United Kingdom; NHS Digital Academy Salford Royal NHS Foundation Trust, Salford, United Kingdom; Chartered Institute for IT, Swindon, United Kingdom; Usher Institute of Population Health Sciences and Informatics, University of Edinburgh, Edinburgh, United Kingdom; Wessex Institute, University of Southampton, Southampton, United Kingdom","Scott P.J., Centre for Healthcare Modelling and Informatics, School of Computing, University of Portsmouth, Portsmouth, United Kingdom; Dunscombe R., NHS Digital Academy Salford Royal NHS Foundation Trust, Salford, United Kingdom; Evans D., Chartered Institute for IT, Swindon, United Kingdom; Mukherjee M., Usher Institute of Population Health Sciences and Informatics, University of Edinburgh, Edinburgh, United Kingdom; Wyatt J.C., Wessex Institute, University of Southampton, Southampton, United Kingdom","Background UK health research policy and plans for population health management are predicated upon transformative knowledge discovery from operational 'Big Data'. Learning health systems require not only data, but feedback loops of knowledge into changed practice. This depends on knowledge management and application, which in turn depends upon effective system design and implementation. Biomedical informatics is the interdisciplinary field at the intersection of health science, social science and information science and technology that spans this entire scope. Issues In the UK, the separate worlds of health data science (bioinformatics, 'Big Data') and effective healthcare system design and implementation (clinical informatics, 'Digital Health') have operated as 'two cultures'. Much National Health Service and social care data is of very poor quality. Substantial research funding is wasted on 'data cleansing' or by producing very weak evidence. There is not yet a sufficiently powerful professional community or evidence base of best practice to influence the practitioner community or the digital health industry. Recommendation The UK needs increased clinical informatics research and education capacity and capability at much greater scale and ambition to be able to meet policy expectations, address the fundamental gaps in the discipline's evidence base and mitigate the absence of regulation. Independent evaluation of digital health interventions should be the norm, not the exception. Conclusions Policy makers and research funders need to acknowledge the existing gap between the 'two cultures' and recognise that the full social and economic benefits of digital health and data science can only be realised by accepting the interdisciplinary nature of biomedical informatics and supporting a significant expansion of clinical informatics capacity and capability. Copyright © 2018 The Author(s).",Big data; Bioinformatics; Education; Evidence-based practice; Health informatics; Health policy; Learning health systems; Programme evaluation,Data Science; Delivery of Health Care; Health Policy; Humans; Learning; Medical Informatics; Research; United Kingdom; article; bioinformatics; cleaning; education; evidence based practice center; expectation; feedback system; funding; health care policy; health science; human; human experiment; knowledge discovery; knowledge management; learning; medical informatics; medical research; national health service; physician; population health; program evaluation; social care; sociology; health care delivery; medical informatics; research; trends; United Kingdom,English,Article,Final,All Open Access; Gold Open Access; Green Open Access,Scopus
Buskirk T.D.; Kirchner A.,"Buskirk, Trent D. (16505908400); Kirchner, Antje (37124071700)",16505908400; 37124071700,"Why Machines Matter for Survey and Social Science Researchers: Exploring Applications of Machine Learning Methods for Design, Data Collection, and Analysis",2020,Big Data Meets Survey Science: A Collection of Innovative Methods,,,,9,62,53,4,10.1002/9781118976357.ch1,https://www.scopus.com/inward/record.uri?eid=2-s2.0-85120923204&doi=10.1002%2f9781118976357.ch1&partnerID=40&md5=cdddcc1a47af0ce3e1357680503ca7ac,"Applied Statistics and Operations Research Department, College of Business, Bowling Green State University, Bowling Green, OH, United States; RTI International, Research Triangle Park, NC, United States","Buskirk T.D., Applied Statistics and Operations Research Department, College of Business, Bowling Green State University, Bowling Green, OH, United States; Kirchner A., RTI International, Research Triangle Park, NC, United States","This chapter explores how techniques from data science, known collectively as machine learning methods (MLMs), can be leveraged in each phase of the survey research process. It provides a brief overview of MLMs and a deeper exploration of how these data science techniques are applied to the social sciences from the perspective of the survey research process including sample design and constructing sampling frames; questionnaire design and evaluation; survey recruitment and data collection; survey data coding and processing; sample weighting and survey adjustment; and data analysis and estimation. The chapter presents a wide array of applications and examples that illustrate how these methods can be used to augment, support, reimagine, improve, and in some places replace the current methodologies. It also discusses how errors in the machine learning process can impact errors we traditionally manage within the survey research process. © 2021 John Wiley & Sons.",,,English,Book chapter,Final,,Scopus
Lahti L.; Mäkelä E.; Tolonen M.,"Lahti, Leo (8679063700); Mäkelä, Eetu (36846381700); Tolonen, Mikko (35879720500)",8679063700; 36846381700; 35879720500,Quantifying bias and uncertainty in historical data collections with probabilistic programming,2020,CEUR Workshop Proceedings,2723,,,280,289,9,3,,https://www.scopus.com/inward/record.uri?eid=2-s2.0-85095968495&partnerID=40&md5=57ce376ecde452a147381473379b9efb,"University of Turku, Turku, Finland; University of Helsinki, Helsinki, Finland","Lahti L., University of Turku, Turku, Finland; Mäkelä E., University of Helsinki, Helsinki, Finland; Tolonen M., University of Helsinki, Helsinki, Finland","The enhanced access to ever-expanding digital data collections and open computational methods have led to the emergence of new research lines within the humanities and social sciences, bringing in new quantitative evidence and insights. Any data interpretation depends critically on understanding of the scope and limitations in data collection, as well as on reliable downstream analysis. Quantitative analysis can complement qualitative research by providing access to overlooked information that is accessible only through systematic discovery and analysis of latent patterns underlying the available data collections. Probabilistic programming is an expanding paradigm in machine learning that provides new statistical tools for intuitive interpretation of complex data sets. This new paradigm stems from Bayesian analysis and emphasizes explicit modeling of the data generating processes and associated uncertainties. Despite its remarkable application potential, probabilistic programming has so far received little attention in computational humanities. We use a brief case study in computational history to demonstrate how probabilistic programming can be incorporated in reproducible data science workflows in order to detect and quantify bias in a widely studied historical text collection, the Eighteenth Century Collections Online.  © 2020 Copyright for this paper by its authors.",Bias; Bibliographic data science; Computational history; Probabilistic programming; Uncertainty,Data Science; Humanities computing; Statistical mechanics; Uncertainty analysis; Bayesian Analysis; Complex datasets; Data interpretation; Explicit modeling; Humanities and social science; Probabilistic programming; Qualitative research; Statistical tools; Data acquisition,English,Conference paper,Final,,Scopus
