Authors,Author full names,Author(s) ID,Title,Year,Source title,Volume,Issue,Art. No.,Page start,Page end,Page count,Cited by,DOI,Link,Affiliations,Authors with affiliations,Abstract,Author Keywords,Index Keywords,Language of Original Document,Document Type,Publication Stage,Open Access,Source
Muzzall E.; Abraham V.; Nakao R.,"Muzzall, Evan (57215317809); Abraham, Vijoy (57933915400); Nakao, Ron (56504910800)",57215317809; 57933915400; 56504910800,A perspective on computational research support programs in the library: More than 20 years of data from Stanford University Libraries,2022,Journal of Librarianship and Information Science,,,,,,,0,10.1177/09610006221124619,https://www.scopus.com/inward/record.uri?eid=2-s2.0-85140265522&doi=10.1177%2f09610006221124619&partnerID=40&md5=8d9b783d35ab63c3138687a7346f3502,"Stanford University, United States","Muzzall E., Stanford University, United States; Abraham V., Stanford University, United States; Nakao R., Stanford University, United States","Presentation of data is a major component to academic research. However, programming languages, computational tools, and methods for exploring and analyzing data can be time consuming and frustrating to learn and finding help with these stages of the broader research process can be daunting. In this work, we highlight the impacts that computational research support programs housed in library contexts can have for fulfilling gaps in student, staff, and faculty research needs. The archival history of one such organization, Software and Services for Data Science (SSDS) in the Stanford University Cecil H. Green Library, is used to outline challenges faced by social sciences and humanities researchers from the 1980s to the present day. To compliment this history, participation metrics from consulting services (1999–2021) and workshops (2000–2021) are presented along with updated workshop participant feedback forms (n = 99) and further illustrate the profound impacts that these services can have for helping researchers succeed. Consulting and workshop metrics indicate that SSDS has supported at least 27,031 researchers between 1999 and 2021 (average of more than 1175 per year). A t-test on the feedback form data indicates that participant knowledge in workshops statistically significantly increased more than one scale point from workshop start to completion. Results also indicate that despite our successes, many past challenges continue to present barriers regardless of exponential advances in computing, teaching, and learning—specifically around learning to access data and learning the software and tools to use it. We hope that our story helps other institutions understand how indispensable computational research support is within the library. © The Author(s) 2022.",Archival research; computational research support; data collection; data science; metadata,,English,Article,Article in press,,Scopus
Keikhosrokiani P.; Asl M.P.,"Keikhosrokiani, Pantea (54420191700); Asl, Moussa Pourya (57190254358)",54420191700; 57190254358,Handbook of research on artificial intelligence applications in literary works and social media,2022,Handbook of Research on Artificial Intelligence Applications in Literary Works and Social Media,,,,1,376,375,10,10.4018/978-1-6684-6242-3,https://www.scopus.com/inward/record.uri?eid=2-s2.0-85147938677&doi=10.4018%2f978-1-6684-6242-3&partnerID=40&md5=9a013bf2d42375984fbb3d635ac8cf4e,"School of Computer Sciences, Universiti Sains Malaysia, Malaysia; School of Humanities, Universiti Sains Malaysia, Malaysia","Keikhosrokiani P., School of Computer Sciences, Universiti Sains Malaysia, Malaysia; Asl M.P., School of Humanities, Universiti Sains Malaysia, Malaysia","Artificial intelligence has been utilized in a diverse range of industries as more people and businesses discover its many uses and applications. A current field of study that requires more attention, as there is much opportunity for improvement, is the use of artificial intelligence within literary works and social media analysis. The Handbook of Research on Artificial Intelligence Applications in Literary Works and Social Media presents contemporary developments in the adoption of artificial intelligence in textual analysis of literary works and social media and introduces current approaches, techniques, and practices in data science that are implemented to scrap and analyze text data. This book initiates a new multidisciplinary field that is the combination of artificial intelligence, data science, social science, literature, and social media study. Covering key topics such as opinion mining, sentiment analysis, and machine learning, this reference work is ideal for computer scientists, industry professionals, researchers, scholars, practitioners, academicians, instructors, and students. © 2023 by IGI Global. All rights reserved.",,,English,Book,Final,,Scopus
Li M.,"Li, Manyu (36028501600)",36028501600,Teaching beginner-level computational social science: interactive open education resources with learnr and shiny apps,2023,Frontiers in Education,8,,1130865,,,,0,10.3389/feduc.2023.1130865,https://www.scopus.com/inward/record.uri?eid=2-s2.0-85162150681&doi=10.3389%2ffeduc.2023.1130865&partnerID=40&md5=95a46ec40d966cbb44374d3e32ac9eca,"Department of Psychology, University of Louisiana at Lafayette, Lafayette, LA, United States","Li M., Department of Psychology, University of Louisiana at Lafayette, Lafayette, LA, United States","The article presents the use of open, inclusive pedagogical frameworks to develop a series of open education resources (OERs), specifically, interactive shiny web applications for teaching beginner-level computational social science (CSS) in undergraduate social science education. CSS is an emerging discipline that integrates data science methods with social science theories and research designs. However, undergraduate social science students could face a lack of a sense of STEM identity or belonging. Also, compared to STEM majors in natural science or engineering, average undergraduate social science students come in with limited mathematical or statistical knowledge. The OERs developed and tested in this article are designed with pedagogical frameworks that help overcome these barriers faced by students from diverse backgrounds and offer students a jump-start in learning CSS. This article presents the details of the tools, classroom implementation (in the form of a 6-week workshop series), the pedagogy frameworks applied, and the assessment methods and outcomes. Copyright © 2023 Li.",computational social science; pedagogy; R programming; research methods; science technology engineering mathematics (STEM); shiny apps; social science; undergraduate education,,English,Article,Final,All Open Access; Gold Open Access,Scopus
Raj N.S.; Renumol V.G.,"Raj, Nisha S (56435809300); Renumol, V.G. (36933888800)",56435809300; 36933888800,Early prediction of student engagement in virtual learning environments using machine learning techniques,2022,E-Learning and Digital Media,19,6,,537,554,17,6,10.1177/20427530221108027,https://www.scopus.com/inward/record.uri?eid=2-s2.0-85131867041&doi=10.1177%2f20427530221108027&partnerID=40&md5=d6cb3ada9b50d8fc626b7fdfa13ba3ce,"Division of Information Technology, School of Engineering, CUSAT, Kochi, India","Raj N.S., Division of Information Technology, School of Engineering, CUSAT, Kochi, India; Renumol V.G., Division of Information Technology, School of Engineering, CUSAT, Kochi, India","Learning analytics aims at helping the students to attain their learning goals. The predictions in learning analytics are made to enhance the effectiveness of educational interferences. This study predicts student engagement at an early phase of a Virtual Learning Environment (VLE) course by analyzing data collected from consecutive years. The prediction model is developed using machine learning techniques applied to a subset of Open University Learning Analytics Dataset, provided by Open University (OU), Britain. The investigated data belongs to 7,775 students who attended social science courses for consecutive assessment years. The experiments are conducted with a reduced feature set to predict whether the students are highly or lowly engaged in the courses. The attributes indicating students' interaction with the VLE, their scores, and final results are the most contributing variables for the predictive analysis. Based on these variables, a reduced feature vector is constructed. The baseline used in the study is the linear regression model. The model’s best results showed 95% accurate, 95% precise, and 98% relevant results with the Random Forest classification algorithm. Early prediction’s relevant features are a subset of click activities, which provided a functional interface between the students and the VLE. © The Author(s) 2022.",Data science applications in education; distance education and online learning; distributed learning environments,,English,Article,Final,,Scopus
Suzumura T.; Sugiki A.; Takizawa H.; Imakura A.; Nakamura H.; Taura K.; Kudoh T.; Hanawa T.; Sekiya Y.; Kobayashi H.; Kuga Y.; Nakamura R.; Jiang R.; Kawase J.; Hanai M.; Miyazaki H.; Ishizaki T.; Shimotoku D.; Miyamoto D.; Aida K.; Takefusa A.; Kurimoto T.; Sasayama K.; Kitagawa N.; Fujiwara I.; Tanimura Y.; Aoki T.; Endo T.; Ohshima S.; Fukazawa K.; Date S.; Uchibayashi T.,"Suzumura, Toyotaro (6603022117); Sugiki, Akiyoshi (24339315700); Takizawa, Hiroyuki (7201843647); Imakura, Akira (6506325190); Nakamura, Hiroshi (58038756200); Taura, Kenjiro (7004542465); Kudoh, Tomohiro (7102843240); Hanawa, Toshihiro (7102927793); Sekiya, Yuji (7006044177); Kobayashi, Hiroki (55926323200); Kuga, Yohei (34880259500); Nakamura, Ryo (55861105900); Jiang, Renhe (57202284492); Kawase, Junya (57222314569); Hanai, Masatoshi (56432572500); Miyazaki, Hiroshi (57573717400); Ishizaki, Tsutomu (57573143700); Shimotoku, Daisuke (57210163491); Miyamoto, Daisuke (14024719500); Aida, Kento (7102911550); Takefusa, Atsuko (7801337085); Kurimoto, Takashi (7005107253); Sasayama, Koji (57573144100); Kitagawa, Naoya (57572954000); Fujiwara, Ikki (36634124900); Tanimura, Yusuke (36864329500); Aoki, Takayuki (56843324500); Endo, Toshio (7403997021); Ohshima, Satoshi (58038756400); Fukazawa, Keiichiro (8404706800); Date, Susumu (7103003722); Uchibayashi, Toshihiro (35103759800)",6603022117; 24339315700; 7201843647; 6506325190; 58038756200; 7004542465; 7102843240; 7102927793; 7006044177; 55926323200; 34880259500; 55861105900; 57202284492; 57222314569; 56432572500; 57573717400; 57573143700; 57210163491; 14024719500; 7102911550; 7801337085; 7005107253; 57573144100; 57572954000; 36634124900; 36864329500; 56843324500; 7403997021; 58038756400; 8404706800; 7103003722; 35103759800,mdx: A Cloud Platform for Supporting Data Science and Cross-Disciplinary Research Collaborations,2022,"Proceedings of the 2022 IEEE International Conference on Dependable, Autonomic and Secure Computing, International Conference on Pervasive Intelligence and Computing, International Conference on Cloud and Big Data Computing, International Conference on Cyber Science and Technology Congress, DASC/PiCom/CBDCom/CyberSciTech 2022",,,,,,,8,10.1109/DASC/PiCom/CBDCom/Cy55231.2022.9927975,https://www.scopus.com/inward/record.uri?eid=2-s2.0-85130040206&doi=10.1109%2fDASC%2fPiCom%2fCBDCom%2fCy55231.2022.9927975&partnerID=40&md5=d8ad54ec3612b3eecfef087e683cfa18,"Information Technology Center, The University of Tokyo, Japan; Information Initiative Center, Hokkaido University, Japan; Cyberscience Center, Tohoku University, Japan; Faculty of Engineering, Information and Systems, University of Tsukuba, Japan; Division for Information and Communication Systems, The University of Tokyo, Japan; Information Systems Architecture Science Research Division, National Institute of Informatics, Japan; Research and Development Center for Academic Networks, National Institute of Informatics, Japan; Research Center for Open Science and Data Platform, National Institute of Informatics, Japan; Digital Architecture Research Center, National Institute of Advanced Industrial Science and Technology, Japan; Global Scientific Information and Computing Center, Tokyo Institute of Technology, Japan; Information Technology Center, Nagoya University, Japan; Academic Center for Computing and Media Studies, Kyoto University, Japan; Cybermedia Center, Osaka University, Japan; Research Institute for Information Technology, Kyushu University, Japan","Suzumura T., Information Technology Center, The University of Tokyo, Japan; Sugiki A., Information Initiative Center, Hokkaido University, Japan; Takizawa H., Cyberscience Center, Tohoku University, Japan; Imakura A., Faculty of Engineering, Information and Systems, University of Tsukuba, Japan; Nakamura H., Information Technology Center, The University of Tokyo, Japan; Taura K., Information Technology Center, The University of Tokyo, Japan; Kudoh T., Information Technology Center, The University of Tokyo, Japan; Hanawa T., Information Technology Center, The University of Tokyo, Japan; Sekiya Y., Information Technology Center, The University of Tokyo, Japan; Kobayashi H., Information Technology Center, The University of Tokyo, Japan; Kuga Y., Information Technology Center, The University of Tokyo, Japan; Nakamura R., Information Technology Center, The University of Tokyo, Japan; Jiang R., Information Technology Center, The University of Tokyo, Japan; Kawase J., Information Technology Center, The University of Tokyo, Japan; Hanai M., Information Technology Center, The University of Tokyo, Japan; Miyazaki H., Division for Information and Communication Systems, The University of Tokyo, Japan; Ishizaki T., Division for Information and Communication Systems, The University of Tokyo, Japan; Shimotoku D., Division for Information and Communication Systems, The University of Tokyo, Japan; Miyamoto D., Division for Information and Communication Systems, The University of Tokyo, Japan; Aida K., Information Systems Architecture Science Research Division, National Institute of Informatics, Japan; Takefusa A., Information Systems Architecture Science Research Division, National Institute of Informatics, Japan; Kurimoto T., Research and Development Center for Academic Networks, National Institute of Informatics, Japan; Sasayama K., Research and Development Center for Academic Networks, National Institute of Informatics, Japan; Kitagawa N., Research and Development Center for Academic Networks, National Institute of Informatics, Japan; Fujiwara I., Research Center for Open Science and Data Platform, National Institute of Informatics, Japan; Tanimura Y., Digital Architecture Research Center, National Institute of Advanced Industrial Science and Technology, Japan; Aoki T., Global Scientific Information and Computing Center, Tokyo Institute of Technology, Japan; Endo T., Global Scientific Information and Computing Center, Tokyo Institute of Technology, Japan; Ohshima S., Information Technology Center, Nagoya University, Japan; Fukazawa K., Academic Center for Computing and Media Studies, Kyoto University, Japan; Date S., Cybermedia Center, Osaka University, Japan; Uchibayashi T., Research Institute for Information Technology, Kyushu University, Japan","The growing amount of data and advances in data science have created a need for a new kind of cloud platform that provides users with flexibility, strong security, and the ability to couple with supercomputers and edge devices through high-performance networks. We have built such a nation-wide cloud platform, called ""mdx""to meet this need. The mdx platform's virtualization service, jointly operated by 9 national universities and 2 national research institutes in Japan, launched in 2021, and more features are in development. Currently mdx is used by researchers in a wide variety of domains, including materials informatics, geo-spatial information science, life science, astronomical science, economics, social science, and computer science. This paper provides an overview of the mdx platform, details the motivation for its development, reports its current status, and outlines its future plans.  © 2022 IEEE.",Cloud Computing; Data Science; High-performance Computing; Interdisciplinarity; Internet of Things,Cloud computing; Data Science; Supercomputers; Cloud platforms; Cloud-computing; Cross-disciplinary research; High performance networks; High-performance computing; Interdisciplinarity; Performance computing; Platform virtualization; Research collaborations; Strong securities; Internet of things,English,Conference paper,Final,All Open Access; Green Open Access,Scopus
Dixon W.G.; van der Veer S.N.; Ali S.M.; Laidlaw L.; Dobson R.J.B.; Sudlow C.; Chico T.; MacArthur J.A.L.; Doherty A.,"Dixon, William G. (8935830000); van der Veer, Sabine N. (55880439800); Ali, Syed Mustafa (57129561300); Laidlaw, Lynn (57877163200); Dobson, Richard J.B. (57277378900); Sudlow, Cathie (57201805681); Chico, Tim (6602881822); MacArthur, Jacqueline A.L. (55946587000); Doherty, Aiden (57220525877)",8935830000; 55880439800; 57129561300; 57877163200; 57277378900; 57201805681; 6602881822; 55946587000; 57220525877,Charting a Course for Smartphones and Wearables to Transform Population Health Research,2023,Journal of Medical Internet Research,25,,e42449,,,,0,10.2196/42449,https://www.scopus.com/inward/record.uri?eid=2-s2.0-85147720605&doi=10.2196%2f42449&partnerID=40&md5=81f9c31c7bae2a6a8e84c66380d715e4,"Centre for Epidemiology Versus Arthritis, Manchester Academic Health Science Centre, University of Manchester, Manchester, United Kingdom; Centre for Health Informatics, Manchester Academic Health Science Centre, Manchester, United Kingdom; Department of Biostatistics and Health Informatics, King's College London, London, United Kingdom; British Heart Foundation Data Science Centre, Health Data Research UK, London, United Kingdom; Big Data Institute, Nuffield Department of Population Health, University of Oxford, Oxford, United Kingdom","Dixon W.G., Centre for Epidemiology Versus Arthritis, Manchester Academic Health Science Centre, University of Manchester, Manchester, United Kingdom; van der Veer S.N., Centre for Health Informatics, Manchester Academic Health Science Centre, Manchester, United Kingdom; Ali S.M., Centre for Epidemiology Versus Arthritis, Manchester Academic Health Science Centre, University of Manchester, Manchester, United Kingdom; Laidlaw L., Centre for Epidemiology Versus Arthritis, Manchester Academic Health Science Centre, University of Manchester, Manchester, United Kingdom; Dobson R.J.B., Department of Biostatistics and Health Informatics, King's College London, London, United Kingdom; Sudlow C., British Heart Foundation Data Science Centre, Health Data Research UK, London, United Kingdom; Chico T., British Heart Foundation Data Science Centre, Health Data Research UK, London, United Kingdom; MacArthur J.A.L., British Heart Foundation Data Science Centre, Health Data Research UK, London, United Kingdom; Doherty A., Big Data Institute, Nuffield Department of Population Health, University of Oxford, Oxford, United Kingdom","The use of data from smartphones and wearable devices has huge potential for population health research, given the high level of device ownership; the range of novel health-relevant data types available from consumer devices; and the frequency and duration with which data are, or could be, collected. Yet, the uptake and success of large-scale mobile health research in the last decade have not met this intensely promoted opportunity. We make the argument that digital person-generated health data are required and necessary to answer many top priority research questions, using illustrative examples taken from the James Lind Alliance Priority Setting Partnerships. We then summarize the findings from 2 UK initiatives that considered the challenges and possible solutions for what needs to be done and how such solutions can be implemented to realize the future opportunities of digital person-generated health data for clinically important population health research. Examples of important areas that must be addressed to advance the field include digital inequality and possible selection bias; easy access for researchers to the appropriate data collection tools, including how best to harmonize data items; analysis methodologies for time series data; patient and public involvement and engagement methods for optimizing recruitment, retention, and public trust; and methods for providing research participants with greater control over their data. There is also a major opportunity, provided through the linkage of digital person-generated health data to routinely collected data, to support novel population health research, bringing together clinician-reported and patient-reported measures. We recognize that well-conducted studies need a wide range of diverse challenges to be skillfully addressed in unison (eg, challenges regarding epidemiology, data science and biostatistics, psychometrics, behavioral and social science, software engineering, user interface design, information governance, data management, and patient and public involvement and engagement). Consequently, progress would be accelerated by the establishment of a new interdisciplinary community where all relevant and necessary skills are brought together to allow for excellence throughout the life cycle of a research study. This will require a partnership of diverse people, methods, and technologies. If done right, the synergy of such apartnership has the potential to transform many millions of people's lives for the better. © 2023 Journal of Medical Internet Research. All rights reserved.",clinical; data; devices; digital; health; mHealth; mobile health; person-generated health data; population health research; research; wearable,Humans; Research Design; Smartphone; Telemedicine; Wearable Electronic Devices; biostatistics; data science; digital divide; health data; human; medical research; population health; psychometry; Review; selection bias; software; time series analysis; electronic device; methodology; smartphone; telemedicine,English,Review,Final,All Open Access; Gold Open Access; Green Open Access,Scopus
Suhaimi M.S.A.B.; Lim A.H.L.; Goh H.-N.,"Suhaimi, Muhd Syazwan Aqrimi Bin (58064666900); Lim, Amy Hui Lan (24171760100); Goh, Hui-Ngo (36634273000)",58064666900; 24171760100; 36634273000,Detecting At-Risk and Withdrawal Students in STEM and Social Science Courses using Predictive and Association Rules Mining,2022,Journal of System and Management Sciences,12,6,,147,162,15,0,10.33168/JSMS.2022.0610,https://www.scopus.com/inward/record.uri?eid=2-s2.0-85146256631&doi=10.33168%2fJSMS.2022.0610&partnerID=40&md5=ef05876384dd370ddd9c3315a8df93f4,"Faculty of Computing and Informatics, Multimedia University, Persiaran Multimedia, Selangor, Cyberjaya, 63100, Malaysia","Suhaimi M.S.A.B., Faculty of Computing and Informatics, Multimedia University, Persiaran Multimedia, Selangor, Cyberjaya, 63100, Malaysia; Lim A.H.L., Faculty of Computing and Informatics, Multimedia University, Persiaran Multimedia, Selangor, Cyberjaya, 63100, Malaysia; Goh H.-N., Faculty of Computing and Informatics, Multimedia University, Persiaran Multimedia, Selangor, Cyberjaya, 63100, Malaysia","This research aims to identify potential at-risk and withdrawal students to help these students in their studies. Interactions consisting of surfing behaviour in the Virtual Learning Environment (VLE) among two different groups of students namely disabled and non-disabled students for Social Science and STEM courses are analysed. Predictive analytics and association rule mining (ARM) analysis are performed. Predictive analytics is performed to predict students’ likelihood of withdrawing from their registered courses. Among the students who choose to pursue their registered courses, predictive analytics is also used to predict at-risk students. Six predictive algorithms namely Decision Tree (DT), Logistic Regression (LR), Naive Bayes (NB), K Nearest Neighbour (KNN), Random Forest (RF), and Support Vector Machine (SVM) are compared. FP-Growth algorithm is applied in ARM analysis. Predictive results show that DT is superior with the accuracy scores reaching 0.91. Most association rules are positively correlated, and they represent the set of commonly surfed pages by the potential at-risk and withdrawal students. The predictive results can help VLE developer to determine the possible algorithms to be used in the intelligent VLE to make accurate predictions based on students’ interactions in the VLE. The results from ARM analysis prove that FP-Growth can also be included in the intelligent VLE. The intelligent VLE can assist the relevant staff in an education institution to provide timely and personalized support to students who are struggling in their studies. This research contributes to precision education through learning analytics. © 2022, Success Culture Press. All rights reserved.",data science applications in education; distance education and online learning; evaluation methodologies,,English,Article,Final,,Scopus
