Shum S.B.; Littlejohn A.; Kitto K.; Crick R.,"Shum, Simon Buckingham (7004820886); Littlejohn, Allison (7005935975); Kitto, Kirsty (26646667100); Crick, Ruth (8924561000)",7004820886; 7005935975; 26646667100; 8924561000,Framing Professional Learning Analytics as Reframing Oneself,2022,IEEE Transactions on Learning Technologies,15,5,,634,649,15,0,10.1109/TLT.2022.3190055,https://www.scopus.com/inward/record.uri?eid=2-s2.0-85135236560&doi=10.1109%2fTLT.2022.3190055&partnerID=40&md5=13289e1886955f3fb22c073e7b00188e,"University of Technology Sydney, Connected Intelligence Centre, Ultimo, 2007, NSW, Australia; University College London, Ucl Knowledge Lab and Institute of Education, London, WC1N 3QS, United Kingdom; White Hart House, Wild Learning, Bristol, BS16 9RH, United Kingdom","Shum S.B., University of Technology Sydney, Connected Intelligence Centre, Ultimo, 2007, NSW, Australia; Littlejohn A., University College London, Ucl Knowledge Lab and Institute of Education, London, WC1N 3QS, United Kingdom; Kitto K., University of Technology Sydney, Connected Intelligence Centre, Ultimo, 2007, NSW, Australia; Crick R., University of Technology Sydney, Connected Intelligence Centre, Ultimo, 2007, NSW, Australia, White Hart House, Wild Learning, Bristol, BS16 9RH, United Kingdom","Central to imagining the future of technology-enhanced professional learning is the question of how data are gathered, analyzed, and fed back to stakeholders. The field of learning analytics (LA) has emerged over the last decade at the intersection of data science, learning sciences, human-centered and instructional design, and organizational change, and so could in principle inform how data can be gathered and analyzed in ways that support professional learning. However, in contrast to formal education where most research in LA has been conducted, much work-integrated learning is experiential, social, situated, and practice-bound. Supporting such learning exposes a significant weakness in LA research, and to make sense of this gap, this article proposes an adaptation of the Knowledge-Agency Window framework. It draws attention to how different forms of professional learning locate on the dimensions of learner agency and knowledge creation. Specifically, we argue that the concept of 'reframing oneself' holds particular relevance for informal, work-integrated learning. To illustrate how this insight translates into LA design for professionals, three examples are provided: first, analyzing personal and team skills profiles (skills analytics); second, making sense of challenging workplace experiences (reflective writing analytics); and third, reflecting on orientation to learning (dispositional analytics). We foreground professional agency as a key requirement for such techniques to be used effectively and ethically.  © 2008-2011 IEEE.",dispositional analytics; learning analytics (LA); professional learning; reflection; self-assessmentÂ technologies; skills analytics; writing analytics; Â Agency,E-learning; Engineering education; Professional aspects; Social networking (online); Social sciences computing; Agency; Dispositional analytic; Learning analytic; Professional learning; Self-assessment; Self-assessment technology; Skill analytic; Social networking (online); Stakeholder; Technological innovation; Writing; Writing analytic; Personnel training,English,Article,Final,All Open Access; Green Open Access,Scopus
Adams J.P.,"Adams, Julian Peter (58199077400)",58199077400,Thinking big – here comes the sun,2023,International Journal of Market Research,,,,,,,0,10.1177/14707853231173262,https://www.scopus.com/inward/record.uri?eid=2-s2.0-85153710583&doi=10.1177%2f14707853231173262&partnerID=40&md5=a6424ae119f103ac537dc592f6f76823,"University for the Creative Arts, United Kingdom","Adams J.P., University for the Creative Arts, United Kingdom","In 2000, Pincott and Branthwaite published ‘Nothing New Under the Sun?’ which discussed the role of the internet in research both in terms of the hazards and opportunities this confers. Specifically, Pincott and Branthwaite argued that whilst the advent of the internet offers up new approaches and techniques, this must not be at the detriment of methodological rigour and standards we have grown accustomed to in the industry. In this paper, it is argued that the advent of big data, big qual and the emerging potential of the metaverse present new opportunities in research but pose the same questions originally conceived by Pincott & Branthwaite, 2000. Moreover, methodological rigour and standards are framed by three interconnected themes, namely, the role of data science and big data, the importance of softer skills of interpretation and narration and finally, the role of theory in elevating and grounding research. © The Author(s) 2023.",big data; big qual; business value; interpretation and narration; metaverse; methodological rigour; social science theory,,English,Article,Article in press,All Open Access; Green Open Access; Hybrid Gold Open Access,Scopus
Vlahovic I.; Biskupic I.O.,"Vlahovic, Ines (56436350200); Biskupic, Ivana Ogrizek (49561079500)",56436350200; 49561079500,Fostering Critical and Computational Thinking in the Field of Primary and Secondary Education in non-STEM Subjects by Using Data Sets and Applications,2023,"2023 46th ICT and Electronics Convention, MIPRO 2023 - Proceedings",,,,672,677,5,0,10.23919/MIPRO57284.2023.10159750,https://www.scopus.com/inward/record.uri?eid=2-s2.0-85164908240&doi=10.23919%2fMIPRO57284.2023.10159750&partnerID=40&md5=e51cd4667f8cc3e804e64539d7cb27a7,"ALGEBRA University College, Zagreb, Croatia","Vlahovic I., ALGEBRA University College, Zagreb, Croatia; Biskupic I.O., ALGEBRA University College, Zagreb, Croatia","Critical and computational thinking in primary and secondary education in recent years shows growing importance in methodical approaches used in the classroom. Although many examples exist for using critical and computational thinking in STEM educational area, the social sciences i.e., non-STEM areas were somehow left out due to the relatively more difficult design of such content, especially in the part of the development of computational thinking. In that context, in this paper we present one way of using critical and computational thinking in non-STEM education, more specifically on the example of historical data sources, through the use of programming in Python. As an example, we use historical data for Trans-Atlantic Slave Trade routes, that were the largest long-distance coerced movement of people in history up to the mid-nineteenth century, for connecting concepts of databases, Data Science and programming for development of critical and computational thinking in context of history science. This way of using modern approaches in classroom should give teachers and pupils a broader picture of importance of interdisciplinary education for critical and computational thinking development through STEM and non-STEM classes that give pupils novel skills needed for future labor market. © 2023 MIPRO Croatian Society.","Computational Thinking; Critical Thinking; Data Science; history, Trans-Atlantic Slave Trade routes; programming; Python; STEM, non-STEM","Commerce; Data Science; High level languages; Microelectronics; Computational thinkings; Critical thinking; Data application; Data set; Historical data; History, trans-atlantic slave trade route; Primary and secondary education; Programming; STEM, non-STEM; Trade routes; Python",English,Conference paper,Final,,Scopus
Ramjan S.; Sunkpho J.,"Ramjan, Sarawut (38562038800); Sunkpho, Jirapon (6505934506)",38562038800; 6505934506,Principles and theories of data mining with RapidMiner,2023,Principles and Theories of Data Mining With RapidMiner,,,,1,319,318,0,10.4018/978-1-6684-4730-7,https://www.scopus.com/inward/record.uri?eid=2-s2.0-85162693197&doi=10.4018%2f978-1-6684-4730-7&partnerID=40&md5=00816033e80498aca644e36b10bec37a,"Thammasat University, Thailand","Ramjan S., Thammasat University, Thailand; Sunkpho J., Thammasat University, Thailand","The demand for skilled data scientists is rapidly increasing as more organizations recognize the value of data-driven decision- making. Data science, data management, and data mining are all critical components for various types of organizations, including large and small corporations, academic institutions, and government entities. For companies, these components serve to extract insights and value from their data, empowering them to make evidence-driven decisions and gain a competitive advantage by discovering patterns and trends and avoiding costly mistakes. Academic institutions utilize these tools to analyze large datasets and gain insights into various scientific fields of study, including genetic data, climate data, financial data, and in the social sciences they are used to analyze survey data, behavioral data, and public opinion data. Governments use data science to analyze data that can inform policy decisions, such as identifying areas with high crime rates, determining which regions need infrastructure development, and predicting disease outbreaks. However, individuals who are not data science experts, but are experts within their own fields, may need to apply their experience to the data they must manage, but still struggle to expand their knowledge of how to use data mining tools such as RapidMiner software. Principles and Theories of Data Mining With RapidMiner is a comprehensive guide for students and individuals interested in experimenting with data mining using RapidMiner software. This book takes a practical approach to learning through the RapidMiner tool, with exercises and case studies that demonstrate how to apply data mining techniques to real-world scenarios. Readers will learn essential concepts related to data mining, such as supervised learning, unsupervised learning, association rule mining, categorical data, continuous data, and data quality. Additionally, readers will learn how to apply data mining techniques to popular algorithms, including k-nearest neighbor (K-NN), decision tree, naïve bayes, artificial neural network (ANN), k-means clustering, and probabilistic methods. By the end of the book, readers will have the skills and confidence to use RapidMiner software effectively and efficiently, making it an ideal resource for anyone, whether a student or a professional, who needs to expand their knowledge of data mining with RapidMiner software. © 2023 by IGI Global. All rights reserved.",,,English,Book,Final,,Scopus
Decuypere M.; Hartong S.,"Decuypere, Mathias (42061376600); Hartong, Sigrid (55485535800)",42061376600; 55485535800,Edunudge,2023,"Learning, Media and Technology",48,1,,138,152,14,3,10.1080/17439884.2022.2086261,https://www.scopus.com/inward/record.uri?eid=2-s2.0-85131785089&doi=10.1080%2f17439884.2022.2086261&partnerID=40&md5=7e2ca722567c7667cf78c6bc19acd1fb,"Methodology of Educational Sciences Research Group, KU Leuven, Leuven, Belgium; Faculty of Humanities and Social Sciences, Helmut Schmidt University, Hamburg, Germany","Decuypere M., Methodology of Educational Sciences Research Group, KU Leuven, Leuven, Belgium; Hartong S., Faculty of Humanities and Social Sciences, Helmut Schmidt University, Hamburg, Germany","Over the past years, there has been an increasing prevalence of ‘nudge thinking’ in the educational field. While (critical) research on the rising adoption of nudging has increasingly proliferated in the broader social sciences over the past decades, nudging in education–what we designate here as Edunudge–is, however, only starting to be given substantial academic attention and still requires more nuanced conceptual and empirical investigation. As we argue in this contribution, such investigations should not only carefully disentangle the enormous complexity of nudging in education, including the role of digital and automated technologies. Equally, they should take more systematically into account the traditional closeness of the fields of pedagogy and behavioral insights. In line with that argumentation, the goal of this article is to develop foundations of such an Edunudge research program, focusing on four different dimensions: the technomodalities, the political economy, the spacetimes, and the pedagogies of Edunudge. © 2022 The Author(s). Published by Informa UK Limited, trading as Taylor & Francis Group.",automated learning technologies; behavioral insights; data science; machine learning; Nudging,,English,Article,Final,All Open Access; Green Open Access; Hybrid Gold Open Access,Scopus
Dudău D.P.; Sava F.A.,"Dudău, Diana Paula (57212151450); Sava, Florin Alin (6701683474)",57212151450; 6701683474,The development and validation of the Romanian version of Linguistic Inquiry and Word Count 2015 (Ro-LIWC2015),2022,Current Psychology,41,6,,3597,3614,17,5,10.1007/s12144-020-00872-4,https://www.scopus.com/inward/record.uri?eid=2-s2.0-85086851941&doi=10.1007%2fs12144-020-00872-4&partnerID=40&md5=c70a2834b330d6950dfaf0c91917ef09,"Department of Psychology, West University of Timisoara, 4 Vasile Pârvan Blvd., Timișoara, 300223, Romania","Dudău D.P., Department of Psychology, West University of Timisoara, 4 Vasile Pârvan Blvd., Timișoara, 300223, Romania; Sava F.A., Department of Psychology, West University of Timisoara, 4 Vasile Pârvan Blvd., Timișoara, 300223, Romania","Today, performing automatic language analysis to extract meaning from natural language is one of the top-notch directions in social science research, but it can be challenging. Linguistic Inquiry and Word Count 2015 (LIWC2015; Pennebaker et al. 2015) is one of the most versatile, yet easy to master instruments to transform any text into data, meeting the needs of psychologists who are not usually proficient in data science. Moreover, LIWC2015 is already available in multiple languages, which opens the door to exciting intercultural quests. The current article introduces the first Romanian version of LIWC2015, Ro-LIWC2015, and thus, contributes to the line of research concerning multilingual analysis. Throughout the paper, we describe the challenges of creating the Romanian dictionary and discuss other linguistics aspects, which could be useful for new adaptations of LIWC2015. Also, we present the results of two studies for assessing the criterion validity of Ro-LIWC2015. The first study focuses on the consistency between the Romanian and the English dictionaries in analyzing a corpus of books. The second study tests whether Ro-LIWC2015 can acquire linguistic differences in contrasting corpora. For this purpose, we analyzed posts from help-seeking forums for anxiety, depression, and health issues, and leveraged supervised learning to address several classification problems. The selected algorithm allows feature ranking, which facilitates more thorough interpretations. The linguistic markers extracted with Ro-LIWC2015 mirrored a number of disorder-specific features of depression and anxiety. Given the obtained results, this research encourages the use of Ro-LIWC2015 for hypothesis testing. © 2020, The Author(s).",Content analysis; LIWC2015; Machine learning; Mental health; Text analysis; Text mining,,English,Article,Final,All Open Access; Hybrid Gold Open Access,Scopus
Bellantuono L.; Monaco A.; Amoroso N.; Lacalamita A.; Pantaleo E.; Tangaro S.; Bellotti R.,"Bellantuono, Loredana (56166549700); Monaco, Alfonso (7201639219); Amoroso, Nicola (55419832300); Lacalamita, Antonio (57226689619); Pantaleo, Ester (16245945500); Tangaro, Sabina (8712490600); Bellotti, Roberto (8419904800)",56166549700; 7201639219; 55419832300; 57226689619; 16245945500; 8712490600; 8419904800,Worldwide impact of lifestyle predictors of dementia prevalence: An eXplainable Artificial Intelligence analysis,2022,Frontiers in Big Data,5,,1027783,,,,4,10.3389/fdata.2022.1027783,https://www.scopus.com/inward/record.uri?eid=2-s2.0-85144553908&doi=10.3389%2ffdata.2022.1027783&partnerID=40&md5=9cf28e0b360c9586ce58cdefb9791f8c,"Dipartimento di Biomedicina Traslazionale e Neuroscienze (DiBraiN), Università degli Studi di Bari Aldo Moro, Bari, Italy; Istituto Nazionale di Fisica Nucleare, Sezione di Bari, Bari, Italy; Dipartimento Interateneo di Fisica, Università degli Studi di Bari Aldo Moro, Bari, Italy; Dipartimento di Farmacia-Scienze del Farmaco, Università degli Studi di Bari Aldo Moro, Bari, Italy; Dipartimento di Scienze del Suolo, della Pianta e degli Alimenti, Università degli Studi di Bari Aldo Moro, Bari, Italy","Bellantuono L., Dipartimento di Biomedicina Traslazionale e Neuroscienze (DiBraiN), Università degli Studi di Bari Aldo Moro, Bari, Italy, Istituto Nazionale di Fisica Nucleare, Sezione di Bari, Bari, Italy; Monaco A., Istituto Nazionale di Fisica Nucleare, Sezione di Bari, Bari, Italy, Dipartimento Interateneo di Fisica, Università degli Studi di Bari Aldo Moro, Bari, Italy; Amoroso N., Istituto Nazionale di Fisica Nucleare, Sezione di Bari, Bari, Italy, Dipartimento di Farmacia-Scienze del Farmaco, Università degli Studi di Bari Aldo Moro, Bari, Italy; Lacalamita A., Dipartimento Interateneo di Fisica, Università degli Studi di Bari Aldo Moro, Bari, Italy; Pantaleo E., Istituto Nazionale di Fisica Nucleare, Sezione di Bari, Bari, Italy, Dipartimento Interateneo di Fisica, Università degli Studi di Bari Aldo Moro, Bari, Italy; Tangaro S., Istituto Nazionale di Fisica Nucleare, Sezione di Bari, Bari, Italy, Dipartimento di Scienze del Suolo, della Pianta e degli Alimenti, Università degli Studi di Bari Aldo Moro, Bari, Italy; Bellotti R., Istituto Nazionale di Fisica Nucleare, Sezione di Bari, Bari, Italy, Dipartimento Interateneo di Fisica, Università degli Studi di Bari Aldo Moro, Bari, Italy","Introduction: Dementia is an umbrella term indicating a group of diseases that affect the cognitive sphere. Dementia is not a mere individual health issue, since its interference with the ability to carry out daily activities entails a series of collateral problems, comprising exclusion of patients from civil rights and welfare, unpaid caregiving work, mostly performed by women, and an additional burden on the public healthcare systems. Thus, gender and wealth inequalities (both among individuals and among countries) tend to amplify the social impact of such a disease. Since at present there is no cure for dementia but only drug treatments to slow down its progress and mitigate the symptoms, it is essential to work on prevention and early diagnosis, identifying the risk factors that increase the probability of its onset. The complex and multifactorial etiology of dementia, resulting from an interplay between genetics and environmental factors, can benefit from a multidisciplinary approach that follows the “One Health” guidelines of the World Health Organization. Methods: In this work, we apply methods of Artificial Intelligence and complex systems physics to investigate the possibility to predict dementia prevalence throughout world countries from a set of variables concerning individual health, food consumption, substance use and abuse, healthcare system efficiency. The analysis uses publicly available indicator values at a country level, referred to a time window of 26 years. Results: Employing methods based on eXplainable Artificial Intelligence (XAI) and complex networks, we identify a group of lifestyle factors, mostly concerning nutrition, that contribute the most to dementia incidence prediction. Discussion: The proposed approach provides a methodological basis to develop quantitative tools for action patterns against such a disease, which involves issues deeply related with sustainable, such as good health and resposible food consumption. Copyright © 2022 Bellantuono, Monaco, Amoroso, Lacalamita, Pantaleo, Tangaro and Bellotti.",AI for social good; complex systems; computational social science; data science for social good; dementia; eXplainable Artificial Intelligence; One Health; sustainable development goals,,English,Article,Final,All Open Access; Gold Open Access; Green Open Access,Scopus
Oberascher M.; Kinzel C.; Kastlunger U.; Schöpf M.; Grimm K.; Plaiasu D.; Rauch W.; Sitzenfrei R.,"Oberascher, Martin (57209278227); Kinzel, Carolina (56997344500); Kastlunger, Ulrich (57201063866); Schöpf, Martin (56450851500); Grimm, Karl (58018278600); Plaiasu, Daniel (58018058900); Rauch, Wolfgang (12758697700); Sitzenfrei, Robert (35604679000)",57209278227; 56997344500; 57201063866; 56450851500; 58018278600; 58018058900; 12758697700; 35604679000,Smart water campus - a testbed for smart water applications,2022,Water Science and Technology,86,11,,2834,2847,13,0,10.2166/wst.2022.369,https://www.scopus.com/inward/record.uri?eid=2-s2.0-85144042813&doi=10.2166%2fwst.2022.369&partnerID=40&md5=9d930f34b274ee587080e7560f23bebf,"Unit of Environmental Engineering, Department of Infrastructure Engineering, Faculty of Engineering Sciences, University of Innsbruck, Technikerstrasse 13, Innsbruck, 6020, Austria; ZetaLabs IT Services, Schumannstraße 6-25, Innsbruck, 6020, Austria; Innsbruck, 6020, Austria; Mariengasse 13/2, Vienna, 1170, Austria; Sensor Network Services, Storchengasse 1, Vienna, 1150, Austria","Oberascher M., Unit of Environmental Engineering, Department of Infrastructure Engineering, Faculty of Engineering Sciences, University of Innsbruck, Technikerstrasse 13, Innsbruck, 6020, Austria; Kinzel C., Unit of Environmental Engineering, Department of Infrastructure Engineering, Faculty of Engineering Sciences, University of Innsbruck, Technikerstrasse 13, Innsbruck, 6020, Austria; Kastlunger U., ZetaLabs IT Services, Schumannstraße 6-25, Innsbruck, 6020, Austria; Schöpf M., Innsbruck, 6020, Austria; Grimm K., Mariengasse 13/2, Vienna, 1170, Austria; Plaiasu D., Sensor Network Services, Storchengasse 1, Vienna, 1150, Austria; Rauch W., Unit of Environmental Engineering, Department of Infrastructure Engineering, Faculty of Engineering Sciences, University of Innsbruck, Technikerstrasse 13, Innsbruck, 6020, Austria; Sitzenfrei R., Unit of Environmental Engineering, Department of Infrastructure Engineering, Faculty of Engineering Sciences, University of Innsbruck, Technikerstrasse 13, Innsbruck, 6020, Austria","The Internet of Things concept includes low-cost sensors in combination with innovative wireless communication technology, supporting a large-scale implementation of measurement equipment in the field of urban water infrastructure (UWI). At present, the potentials of such smart solutions are often unclear, making it difficult for decision-makers to justify investments. To address this shortcoming, the Smart Campus is represented as an innovative testbed for smart and data-driven applications in the field of network-based UWI. During the last few years, the campus area of the University of Innsbruck has been comprehensively equipped with a variety of low-cost sensors for monitoring and controlling the UWI in high resolution (1-15 min). The experiences showed that the quality of service is influenced by the choice of communication technology and the installation location, thereby affecting the desired applications. Additionally, water distribution and urban drainage network including nature-based solutions have been integrated into an overall monitored system extended by measures to involve the urban population. This integrative approach allows the usage of synergies for the implementation and supports cross-system improvements (e.g., smart rainwater harvesting). However, an integration of different participants also implies new requirements for the project team (e.g., including social science). © 2022 The Authors.",information and communication technologies; integrative management; real-time monitoring; university campus; urban population; urban water infrastructure,Humans; Water; Wireless Technology; Costs; Decision making; Investments; Quality of service; Water supply; Water supply systems; drinking water; water; Information and Communication Technologies; Integrative managements; Low-cost sensors; Real time monitoring; University campus; Urban population; Urban water infrastructure; Urban waters; Water infrastructure; Wireless communication technology; decision making; drainage network; rainwater; urban drainage; urban population; water management; Article; autumn; communication technology; computer scientist; data science; distance learning; environmental temperature; fluid intake; human; information technology; internet of things; measurement; spring; surface area; surface property; urban area; urban population; water loss; water supply; water temperature; wireless communication; wireless communication; Testbeds,English,Article,Final,All Open Access; Gold Open Access,Scopus
